{
  "$schema": "../../../data/faction.schema.json",
  "schemaVersion": 2,
  "id": "gif/necron",
  "groups": [
    {
      "id": "starter",
      "label": "Стартовые"
    },
    {
      "id": "upgrade-1",
      "label": "Уровень 1"
    },
    {
      "id": "upgrade-2",
      "label": "Уровень 2"
    },
    {
      "id": "upgrade-3",
      "label": "Уровень 3"
    }
  ],
  "cards": [
    {
      "id": "gif/necron/combat/s1",
      "category": "combat",
      "asset": {
        "file": "combat/s1.jpg",
        "sourceText": "printed"
      },
      "render": {
        "profile": "combat",
        "template": {
          "picture": "pictures/templates/gif/necron/combat/s1.jpg",
          "artwork": {
            "src": "pictures/artwork/gif/necron/combat/s1.webp",
            "box": [
              163,
              163,
              745,
              937
            ],
            "sha256": "6588a82caa2afbd6a1aa1aeea167c8a56b342f9920db16202caa043d03a70772"
          }
        }
      },
      "group": "starter",
      "text": {
        "title": "Прорвать Строй",
        "icons": "BB",
        "source": "https://github.com/MolonLabem/Forbidden_Star/blob/7a9a58bf2284863250f7d4284e292a7c18315a4e/page/factions/gif/necron/combat/s1.jpg",
        "aspect": 0.7194928684627575,
        "general": "",
        "unit": "Воин/Жнец: Получите 1 [M]."
      }
    },
    {
      "id": "gif/necron/combat/s2",
      "category": "combat",
      "asset": {
        "file": "combat/s2.jpg",
        "sourceText": "printed"
      },
      "render": {
        "profile": "combat",
        "template": {
          "picture": "pictures/templates/gif/necron/combat/s2.jpg",
          "artwork": {
            "src": "pictures/artwork/gif/necron/combat/s2.webp",
            "box": [
              163,
              163,
              745,
              937
            ],
            "sha256": "95e6cb08da622b2ae02665c239d5e25d65a2647f9dac676cbe215e24985c2f0a"
          }
        }
      },
      "group": "starter",
      "text": {
        "title": "Фаланга",
        "icons": "SS",
        "source": "https://github.com/MolonLabem/Forbidden_Star/blob/7a9a58bf2284863250f7d4284e292a7c18315a4e/page/factions/gif/necron/combat/s2.jpg",
        "aspect": 0.7194928684627575,
        "general": "",
        "unit": "Воин/Жнец: Получите 1 [M]."
      }
    },
    {
      "id": "gif/necron/combat/s3",
      "category": "combat",
      "asset": {
        "file": "combat/s3.jpg",
        "sourceText": "printed"
      },
      "render": {
        "profile": "combat",
        "template": {
          "picture": "pictures/templates/gif/necron/combat/s3.jpg",
          "artwork": {
            "src": "pictures/artwork/gif/necron/combat/s3.webp",
            "box": [
              163,
              163,
              745,
              628
            ],
            "sha256": "6f90e7b081ad115d09822f92742974b3f36d1861787478cc2f10c4abf40c4aa1"
          }
        }
      },
      "group": "starter",
      "text": {
        "title": "Криптек",
        "icons": "M",
        "source": "https://github.com/MolonLabem/Forbidden_Star/blob/7a9a58bf2284863250f7d4284e292a7c18315a4e/page/factions/gif/necron/combat/s3.jpg",
        "aspect": 0.7194928684627575,
        "general": "Получите 1 [B], 1 [S] или 1 [M]. *newline* Потратьте 1 [M], чтобы выбрать: забрать 1 ваш отряд из этого мира и разместить его деморализованным в любом дружественном мире, который содержит постройку; забрать 1 ваш отряд с командным уровнем 0-1 из любого мира, который содержит постройку, и разместить его в этом мире.",
        "unit": ""
      }
    },
    {
      "id": "gif/necron/combat/s4",
      "category": "combat",
      "asset": {
        "file": "combat/s4.jpg",
        "sourceText": "printed"
      },
      "render": {
        "profile": "combat",
        "template": {
          "picture": "pictures/templates/gif/necron/combat/s4.jpg",
          "artwork": {
            "src": "pictures/artwork/gif/necron/combat/s4.webp",
            "box": [
              163,
              163,
              745,
              680
            ],
            "sha256": "e9f21e9f975be51c0babdbc35d0f6eaf66372ab50ae8f86d4b6271b8e5b5eac1"
          }
        }
      },
      "group": "starter",
      "text": {
        "title": "Освежеванные",
        "icons": "B",
        "source": "https://github.com/MolonLabem/Forbidden_Star/blob/7a9a58bf2284863250f7d4284e292a7c18315a4e/page/factions/gif/necron/combat/s4.jpg",
        "aspect": 0.7194928684627575,
        "general": "Получите 2 (B).",
        "unit": "Воин/Жнец: Если у вашего противника есть хотя бы 1 [M], то вынудите его потерять 1 [M], затем получите 1 [M]."
      }
    },
    {
      "id": "gif/necron/combat/s5",
      "category": "combat",
      "asset": {
        "file": "combat/s5.jpg",
        "sourceText": "printed"
      },
      "render": {
        "profile": "combat",
        "template": {
          "picture": "pictures/templates/gif/necron/combat/s5.jpg",
          "artwork": {
            "src": "pictures/artwork/gif/necron/combat/s5.webp",
            "box": [
              163,
              163,
              745,
              680
            ],
            "sha256": "b66a50e47cfefdf5a892782f7180695bb8c777c4e072d8674352fd93b0570cf5"
          }
        }
      },
      "group": "starter",
      "text": {
        "title": "Лорд",
        "icons": "",
        "source": "https://github.com/MolonLabem/Forbidden_Star/blob/7a9a58bf2284863250f7d4284e292a7c18315a4e/page/factions/gif/necron/combat/s5.jpg",
        "aspect": 0.7194928684627575,
        "general": "Получите 1 [M]. *newline* Восстановите 1 ваш отряд.",
        "unit": "Воин/Жнец/Бессмертный: Получите 1 [B] или 1 [S] за каждый ваш [M]."
      }
    },
    {
      "id": "gif/necron/combat/t0_1",
      "category": "combat",
      "asset": {
        "file": "combat/t0_1.jpg",
        "sourceText": "printed"
      },
      "render": {
        "profile": "combat",
        "template": {
          "picture": "pictures/templates/gif/necron/combat/t0_1.jpg",
          "artwork": {
            "src": "pictures/artwork/gif/necron/combat/t0_1.webp",
            "box": [
              163,
              163,
              745,
              889
            ],
            "sha256": "91a8b73459afa975f749e6f0cd3a681d16e08a1c7d461a635b76204d91b7bf54"
          }
        }
      },
      "group": "upgrade-1",
      "text": {
        "title": "Рой Карноптеков",
        "icons": "BM",
        "source": "https://github.com/MolonLabem/Forbidden_Star/blob/7a9a58bf2284863250f7d4284e292a7c18315a4e/page/factions/gif/necron/combat/t0_1.jpg",
        "aspect": 0.7194928684627575,
        "general": "Получите 1 [D]. *newline* Бесплатно разместите 1 жетон подкрепления в эту область.",
        "unit": ""
      }
    },
    {
      "id": "gif/necron/combat/t0_2",
      "category": "combat",
      "asset": {
        "file": "combat/t0_2.jpg",
        "sourceText": "printed"
      },
      "render": {
        "profile": "combat",
        "template": {
          "picture": "pictures/templates/gif/necron/combat/t0_2.jpg",
          "artwork": {
            "src": "pictures/artwork/gif/necron/combat/t0_2.webp",
            "box": [
              163,
              163,
              745,
              632
            ],
            "sha256": "f97f515df35294949c621475e80c575b88dc33399609cfe304abaf51c16fad56"
          }
        }
      },
      "group": "upgrade-1",
      "text": {
        "title": "Разрушители",
        "icons": "BBM",
        "source": "https://github.com/MolonLabem/Forbidden_Star/blob/7a9a58bf2284863250f7d4284e292a7c18315a4e/page/factions/gif/necron/combat/t0_2.jpg",
        "aspect": 0.7194928684627575,
        "general": "Потратьте 1 [S] или 1 [M], чтобы получить 2 (B).",
        "unit": "Бессмертный/Жнец: Если у вашего противника есть хотя бы 1 деморализованный отряд, то получите 2 (B)."
      }
    },
    {
      "id": "gif/necron/combat/t0_3",
      "category": "combat",
      "asset": {
        "file": "combat/t0_3.jpg",
        "sourceText": "printed"
      },
      "render": {
        "profile": "combat",
        "template": {
          "picture": "pictures/templates/gif/necron/combat/t0_3.jpg",
          "artwork": {
            "src": "pictures/artwork/gif/necron/combat/t0_3.webp",
            "box": [
              163,
              163,
              745,
              625
            ],
            "sha256": "58118e0c687d7e58cb51354f87bedaddb5527dfc03b99dbe8cb2b8b3ba463ca0"
          }
        }
      },
      "group": "upgrade-1",
      "text": {
        "title": "Лич Страж",
        "icons": "SSM",
        "source": "https://github.com/MolonLabem/Forbidden_Star/blob/7a9a58bf2284863250f7d4284e292a7c18315a4e/page/factions/gif/necron/combat/t0_3.jpg",
        "aspect": 0.7194928684627575,
        "general": "Деморализуйте 1 ваш отряд, затем ваш противник должен выбрать и деморализовать 1 свой отряд.",
        "unit": "Бессмертный/Жнец: Если у вашего противника есть хотя бы 1 деморализованный отряд, то получите 2 (S)."
      }
    },
    {
      "id": "gif/necron/combat/t0_4",
      "category": "combat",
      "asset": {
        "file": "combat/t0_4.jpg",
        "sourceText": "printed"
      },
      "render": {
        "profile": "combat",
        "template": {
          "picture": "pictures/templates/gif/necron/combat/t0_4.jpg",
          "artwork": {
            "src": "pictures/artwork/gif/necron/combat/t0_4.webp",
            "box": [
              163,
              163,
              745,
              889
            ],
            "sha256": "f80aa9b9e611e26528527d91fdfb7577662b38a7aed10b1e0991308a0463a781"
          }
        }
      },
      "group": "upgrade-1",
      "text": {
        "title": "Владыка",
        "icons": "MMM",
        "source": "https://github.com/MolonLabem/Forbidden_Star/blob/7a9a58bf2284863250f7d4284e292a7c18315a4e/page/factions/gif/necron/combat/t0_4.jpg",